{
  "schemaVersion": 1,
  "name": "example-pilot-app",
  "displayName": "Example pilot app",
  "description": "Reference manifest for MM-KERNEL-201; not loaded by the kernel until MM-KERNEL-501.",
  "version": "0.1.0",
  "entry": {
    "module": "./index.mjs",
    "export": "handleApi"
  },
  "api": {
    "method": "POST",
    "pathSuffix": "example-pilot-app"
  },
  "capabilities": {
    "required": ["inference"],
    "optional": ["monitor.read"]
  },
  "routes": {
    "dashboardIssueId": 999999,
    "slug": "Example_pilot"
  }
}
